{
  "manifest_version": "bigbounce-experiment/v1",
  "id": "p2-g1-gradient-transmission",
  "title": "G1 gradient-transmission scheme-dependence (Phase 1, T_c ~ 1/dcut)",
  "program": "bounce-theory",
  "paper": "P2",
  "kind": "analysis",
  "inputs": [],
  "apis": [],
  "code": [
    {
      "path": "research/cubic_bounce_transmission/g1_gradient_transmission_scheme.py",
      "entrypoint": "python3 g1_gradient_transmission_scheme.py",
      "sha256": null
    }
  ],
  "environment": {
    "python": "requirements.txt (repo root: numpy, scipy, astropy, sympy-adjacent research deps)",
    "hardware": "cpu-only"
  },
  "original_run": {
    "venue": "local",
    "gpu": null,
    "pod_id_or_host": null,
    "date": "2026-07-17",
    "wall_clock": "seconds-minutes (log timestamp 2026-07-17 13:47)",
    "actual_cost_usd": 0.0
  },
  "reproduction": {
    "recommended_venue": "local",
    "est_wall_clock": "minutes",
    "est_cost_usd": 0.0,
    "parallelizable": true,
    "resume_support": true,
    "notes": "Deterministic local scheme-dependence scan; no GPU or external data required."
  },
  "outputs": [
    {
      "locator": "research/cubic_bounce_transmission/g1_gradient_transmission_results.json",
      "type": "result-json",
      "checksum": null
    },
    {
      "locator": "research/cubic_bounce_transmission/g1_gradient_transmission_results.log",
      "type": "receipt",
      "checksum": null
    }
  ],
  "verification": "Re-run and diff g1_gradient_transmission_results.json against the committed copy; scheme-dependence coefficient c ~ 1/dcut should match to numeric tolerance (<1e-6 relative).",
  "status": "runnable-now",
  "provenance": [
    "project-context/EXPERIMENT_INVENTORY_2026-08-05.md \u00a7PROGRAM: bounce-theory / P2 \u2014 G1 gradient-transmission bullet",
    "COMPUTE_CAMPAIGN_2026-07-17.md"
  ]
}
